DROP TABLE IF EXISTS t1, t2;
SELECT ENGINE FROM information_schema.ENGINES WHERE ENGINE='ZSET';
ENGINE
ZSET
CREATE TABLE t1 (
member VARBINARY(255) NOT NULL,
score  DOUBLE NOT NULL,
PRIMARY KEY (member),
KEY idx_score (score, member)
) ENGINE=ZSET;
INSERT INTO t1 VALUES ('apple', 3), ('banana', 1), ('cherry', 1),
('egg', 1), ('durian', 2.5);
SELECT member, score FROM t1 ORDER BY score, member;
member	score
banana	1
cherry	1
egg	1
durian	2.5
apple	3
SELECT score FROM t1 WHERE member = 'apple';
score
3
SELECT member FROM t1 WHERE score BETWEEN 1 AND 1 ORDER BY score, member;
member
banana
cherry
egg
SELECT member FROM t1 ORDER BY score DESC LIMIT 1;
member
apple
UPDATE t1 SET score = 0.5 WHERE member = 'apple';
SELECT score FROM t1 WHERE member = 'apple';
score
0.5
DELETE FROM t1 WHERE score = 1;
SELECT COUNT(*) FROM t1;
COUNT(*)
2
INSERT INTO t1 VALUES ('durian', 9);
ERROR 23000: Duplicate entry 'durian' for key 't1.PRIMARY'
CREATE TABLE t2 (a INT) ENGINE=ZSET;
ERROR HY000: Table storage engine for 't2' doesn't have this option
TRUNCATE TABLE t1;
SELECT COUNT(*) FROM t1;
COUNT(*)
0
DROP TABLE t1;
DROP TABLE IF EXISTS t1;
CREATE TABLE t1 (
member VARBINARY(255) NOT NULL,
score  DOUBLE NOT NULL,
PRIMARY KEY (member),
KEY idx_score (score, member)
) ENGINE=ZSET;
SELECT COUNT(*) FROM t1;
COUNT(*)
0
SELECT member FROM t1 ORDER BY score, member;
member
DELETE FROM t1 WHERE score = 1;
DELETE FROM t1 WHERE member = 'x';
INSERT INTO t1 VALUES ('a', 1), ('b', 2), ('c', 3), ('d', 4), ('e', 5);
SELECT member FROM t1 ORDER BY score DESC;
member
e
d
c
b
a
DELETE FROM t1 WHERE member = 'b';
SELECT COUNT(*) FROM t1;
COUNT(*)
4
UPDATE t1 SET member = 'bb', score = 2 WHERE member = 'a';
SELECT member FROM t1 WHERE score = 2;
member
bb
REPLACE INTO t1 VALUES ('c', 30);
SELECT score FROM t1 WHERE member = 'c';
score
30
SELECT COUNT(*) FROM t1;
COUNT(*)
4
UPDATE t1 SET score = score + 10;
SELECT member, score FROM t1 ORDER BY score, member;
member	score
bb	12
d	14
e	15
c	40
SELECT member FROM t1 ORDER BY member;
member
bb
c
d
e
DROP TABLE t1;
DROP TABLE IF EXISTS t1;
CREATE TABLE t1 (
member VARBINARY(255) NOT NULL,
score  DOUBLE NOT NULL,
PRIMARY KEY (member),
KEY idx_score (score, member)
) ENGINE=ZSET;
INSERT INTO t1 VALUES ('a', -5), ('b', 0), ('c', 2.5), ('d', -0.5), ('e', 10);
SELECT member, score FROM t1 ORDER BY score, member;
member	score
a	-5
d	-0.5
b	0
c	2.5
e	10
UPDATE t1 SET score = score + 10 WHERE score BETWEEN -1 AND 3;
SELECT member, score FROM t1 ORDER BY score, member;
member	score
a	-5
d	9.5
b	10
e	10
c	12.5
DELETE FROM t1 WHERE score >= 15;
SELECT COUNT(*) FROM t1;
COUNT(*)
5
UPDATE t1 SET score = score + 1;
UPDATE t1 SET score = score + 1;
SELECT member, score FROM t1 ORDER BY score, member;
member	score
a	-3
d	11.5
b	12
e	12
c	14.5
UPDATE t1 SET score = 100 WHERE member = 'a';
SELECT member, score FROM t1 ORDER BY score, member;
member	score
d	11.5
b	12
e	12
c	14.5
a	100
SELECT member, score FROM t1 ORDER BY score DESC;
member	score
a	100
c	14.5
b	12
e	12
d	11.5
INSERT INTO t1 VALUES ('x', 5), ('y', 5), ('z', 5);
SELECT member, score FROM t1 ORDER BY member;
member	score
a	100
b	12
c	14.5
d	11.5
e	12
x	5
y	5
z	5
REPLACE INTO t1 VALUES ('b', 50);
SELECT member, score FROM t1 WHERE member = 'b';
member	score
b	50
SELECT COUNT(*) FROM t1 WHERE score <= 5;
COUNT(*)
3
SELECT COUNT(*) FROM t1 WHERE score > 5;
COUNT(*)
5
UPDATE t1 SET member = 'b2', score = score + 1 WHERE member = 'b';
SELECT member, score FROM t1 WHERE member IN ('b', 'b2');
member	score
b2	51
SELECT member FROM t1 ORDER BY score, member LIMIT 2;
member
x
y
DROP TABLE t1;
DROP TABLE IF EXISTS t1, t2;
CREATE TABLE t1 (
member VARBINARY(255) NOT NULL,
score  DOUBLE NOT NULL,
PRIMARY KEY (member),
KEY idx_score (score, member)
) ENGINE=ZSET;
CREATE TABLE t2 (
member VARBINARY(255) NOT NULL,
score  DOUBLE NOT NULL,
PRIMARY KEY (member),
KEY idx_score (score, member)
) ENGINE=ZSET;
INSERT INTO t1 VALUES ('a', 1), ('b', 2), ('c', 1), ('d', 3), ('e', 2), ('f', 1);
INSERT INTO t2 VALUES ('a', 10), ('b', 20), ('z', 99);
SELECT score, COUNT(*), SUM(score), AVG(score), MIN(score), MAX(score)
FROM t1 GROUP BY score ORDER BY score;
score	COUNT(*)	SUM(score)	AVG(score)	MIN(score)	MAX(score)
1	3	3	1	1	1
2	2	4	2	2	2
3	1	3	3	3	3
SELECT score, COUNT(*) FROM t1 GROUP BY score HAVING COUNT(*) >= 2 ORDER BY score;
score	COUNT(*)
1	3
2	2
SELECT t1.member, t1.score, t2.score FROM t1 JOIN t2 ON t1.member = t2.member
ORDER BY t1.member;
member	score	score
a	1	10
b	2	20
SELECT t1.member, t2.score FROM t1 LEFT JOIN t2 ON t1.member = t2.member
ORDER BY t1.member;
member	score
a	10
b	20
c	NULL
d	NULL
e	NULL
f	NULL
SELECT member FROM t1 WHERE member IN (SELECT member FROM t2) ORDER BY member;
member
a
b
SELECT member FROM t1 WHERE EXISTS (SELECT 1 FROM t2 WHERE t2.member = t1.member)
ORDER BY member;
member
a
b
SELECT DISTINCT score FROM t1 ORDER BY score;
score
1
2
3
SELECT member FROM t1 UNION SELECT member FROM t2 ORDER BY member;
member
a
b
c
d
e
f
z
DROP TABLE t1, t2;
DROP TABLE IF EXISTS t1;
SET GLOBAL zset_memtable_limit = 1000;
CREATE TABLE t1 (
member VARBINARY(255) NOT NULL,
score  DOUBLE NOT NULL,
PRIMARY KEY (member),
KEY idx_score (score, member)
) ENGINE=ZSET;
SET SESSION cte_max_recursion_depth = 2000;
INSERT INTO t1 (member, score)
WITH RECURSIVE s(n) AS (SELECT 1 UNION ALL SELECT n+1 FROM s WHERE n < 1005)
SELECT CONCAT('m_', LPAD(n, 4, '0')), n FROM s;
SELECT COUNT(*) FROM t1;
COUNT(*)
1005
UPDATE t1 SET score = score - 10;
SELECT COUNT(*) FROM t1;
COUNT(*)
1005
SELECT member, score FROM t1
WHERE member IN ('m_0001', 'm_1001', 'm_1005')
ORDER BY member;
member	score
m_0001	-9
m_1001	991
m_1005	995
UPDATE t1 SET score = score + 10;
SELECT member, score FROM t1
WHERE member IN ('m_0001', 'm_1001', 'm_1005')
ORDER BY member;
member	score
m_0001	1
m_1001	1001
m_1005	1005
UPDATE t1 SET score = score * 2 WHERE score BETWEEN 10 AND 12;
SELECT member, score FROM t1
WHERE member IN ('m_0010', 'm_0011', 'm_0012')
ORDER BY member;
member	score
m_0010	20
m_0011	22
m_0012	24
SELECT COUNT(*), MIN(score), MAX(score) FROM t1;
COUNT(*)	MIN(score)	MAX(score)
1005	1	1005
DROP TABLE t1;
SET GLOBAL zset_memtable_limit = 100000;
